target,text,num_characters,num_words,num_sentences,transformed_text
0,hey miss tm last night phone charg smile meet friend shortli,111,27,2,hey miss tm last night phone charg smile meet friend shortli
0,whatev juliana whatev want,40,9,2,whatev juliana whatev want
0,friendship game play word say start march end may tomorrow yesterday today e,141,35,1,friendship game play word say start march end may tomorrow yesterday today e
1,rington club gr8 new poli direct mobil everi week,63,13,1,rington club gr8 new poli direct mobil everi week
0,hello sort town alreadi dont rush home eat nacho let know eta,104,27,5,hello sort town alreadi dont rush home eat nacho let know eta
0,ok lor anyway thk cant get ticket co like quit late alreadi u wan 2 go look 4 ur fren darren wif,133,34,4,ok lor anyway thk cant get ticket co like quit late alreadi u wan 2 go look 4 ur fren darren wif
1,bank granit issu explos pick member 300 nasdaq symbol cdgt per,137,42,1,bank granit issu explo pick member 300 nasdaq symbol cdgt per
0,way ur home,26,8,1,way ur home
0,dizzamn aight ask suitem get back,53,12,1,dizzamn aight ask suitem get back
0,nimbomson yep phone know one obvious co that real word,70,15,3,nimbomson yep phone know one obviou co real word
0,love cuddl want hold strong arm right,67,17,2,love cuddl want hold strong arm right
0,r u contin,22,6,1,r u contin
0,pay like lt gt yr difficult,63,19,1,pay like lt gt yr difficult
1,bore housew chat n date rate landlin,95,17,4,bore housew chat n date rate landlin
1,tri call repli sm video mobil 750 min unlimit text free camcord repli call 08000930705 del thur,143,28,1,tri call repli sm video mobil 750 min unlimit text free camcord repli call 08000930705 del thur
0,k k give treat,33,10,1,k k give treat
1,2nd time tri contact u prize 2 claim easi call 087104711148 10p per minut,159,34,4,2nd time tri contact u prize 2 claim easi call 087104711148 10p per minut
0,gon na worri noth wo give money use,74,20,2,gon na worri noth wo give money use
0,get gift year didnt get anyth bad,60,15,3,get gift year didnt get anyth bad
0,somewher beneath pale moon light someon think u dream come true goodnit amp sweet dream,144,28,1,somewh beneath pale moon light someon think u dream come true goodnit amp sweet dream
0,well pattern emerg friend tell drive come smoke tell weed smoke thing see hesit,220,44,1,well pattern emerg friend tell drive come smoke tell weed smoke thing see hesit
0,ow u paid told u would call,55,11,1,ow u paid told u would call
0,im fine babe aint 2 much tho saw scari movi yest quit funni want 2mrw afternoon town mall sumthin xx,127,30,4,im fine babe aint 2 much tho saw scari movi yest quit funni want 2mrw afternoon town mall sumthin xx
0,reach home 5 min,27,8,1,reach home 5 min
0,forgot work today wan na chat thing ok drop text free bore etc ring hope well nose essay xx,162,41,3,forgot work today wan na chat thing ok drop text free bore etc ring hope well nose essay xx
0,ha must walk everywher take tram cousin said walk vic market hotel,112,25,3,ha must walk everywh take tram cousin said walk vic market hotel
1,wan2 win westlif 4 u m8 current tour 1 unbreak 2 untam 3 unkempt text 3 cost 50p text,161,42,5,wan2 win westlif 4 u m8 current tour 1 unbreak 2 untam 3 unkempt text 3 cost 50p text
1,pleas call custom servic repres freephon 0808 145 4742 guarante cash prize,149,25,1,plea call custom servic repr freephon 0808 145 4742 guarant cash prize
0,discuss mother ah,30,6,1,discuss mother ah
0,ok,3,2,1,ok
0,sorri ca text amp drive coher see twenti,61,16,1,sorri ca text amp drive coher see twenti
1,receiv week tripl echo rington shortli enjoy,73,15,2,receiv week tripl echo rington shortli enjoy
0,place get room cheap,39,11,1,place get room cheap
0,eek lot time especi sinc american pie like 8 minut long ca stop sing,103,24,2,eek lot time especi sinc american pie like 8 minut long ca stop sing
0,onlyfound afew day,48,9,1,onlyfound afew day
1,u select stay 1 250 top british hotel noth holiday valu dial 08712300220 claim nation rate call bx526 sw73ss,159,34,4,u select stay 1 250 top british hotel noth holiday valu dial 08712300220 claim nation rate call bx526 sw73ss
0,univers southern california,34,5,1,univ southern california
0,pick rayan macleran,37,8,1,pick rayan macleran
0,u gd lor go shop got stuff u wan 2 watch infern affair come lar,89,23,3,u gd lor go shop got stuff u wan 2 watch infern affair come lar
0,well ball time make call,31,8,3,well ball time make call
0,wat time wan today,22,6,1,wat time wan today
0,lt gt mca conform,36,14,2,lt gt mca conform
0,oh ok wat ur email,23,8,1,oh ok wat ur email
0,ye princess go make moan,45,12,2,ye princess go make moan
0,lol ok rememb til last nite,42,10,1,lol ok rememb til last nite
0,anyway mani good even u,40,12,2,anyway mani good even u
0,cool text,28,9,1,cool text
0,sorri vikki watch olav mandara movi kano trishul theatr wit frnd,84,17,1,sorri vikki watch olav mandara movi kano trishul theatr wit frnd
0,happi babe woo hoo parti dude,52,14,2,happi babe woo hoo parti dude
0,take italian food pretti dress panti,78,19,3,take italian food pretti dress panti
0,wot u 2 thout u gon na call txt bak luv k,54,18,3,wot u 2 thout u gon na call txt bak luv k
1,chosen receiv award pl call claim number 09066364311 collect award select receiv valu mobil custom,159,30,2,chosen receiv award pl call claim number 09066364311 collect award select receiv valu mobil custom
0,hold,23,6,1,hold
0,dont flatter tell man mine two pint carlin ten minut pleas,93,18,1,dont flatter tell man mine two pint carlin ten minut plea
0,hope scare,24,6,1,hope scare
0,cant pick phone right pl send messag,51,12,2,cant pick phone right pl send messag
0,home n readi,22,7,1,home n readi
1,pleas call custom servic repres freephon 0808 145 4742 guarante cash prize,149,25,1,plea call custom servic repr freephon 0808 145 4742 guarant cash prize
0,time u get,23,7,1,time u get
0,liter bed like lt gt hour,65,19,1,liter bed like lt gt hour
0,ye reg ciao,21,7,1,ye reg ciao
0,mean websit ye,29,8,2,mean websit ye
1,win cash prize prize worth,47,10,1,win cash prize prize worth
1,thank rington order refer number mobil charg tone arriv pleas call custom servic 09065989182,156,25,2,thank rington order refer number mobil charg tone arriv plea call custom servic 09065989182
0,lol could starv lose pound end day,66,17,1,lol could starv lose pound end day
0,yeah impress got,32,7,1,yeah impress got
0,ok ok take care understand,34,9,2,ok ok take care understand
0,motiv behind everi dark shine light wait find behind everi best friend alway trust love bslvyl,153,30,2,motiv behind everi dark shine light wait find behind everi best friend alway trust love bslvyl
0,ya ok dinner,23,7,1,ya ok dinner
0,slept,32,7,1,slept
0,dont make ne plan nxt wknd coz want us come ok,69,16,1,dont make ne plan nxt wknd coz want us come ok
0,school start stay weather like food social support system like friend school thing import,180,39,6,school start stay weather like food social support system like friend school thing import
0,ha ha nan yalrigu heltini iyo kothi chikku u share mani thing wit far told bodi even utter word abt u ur trust much tell other plz nxt time dont use word ok chikku,255,68,2,ha ha nan yalrigu heltini iyo kothi chikku u share mani thing wit far told bodi even utter word abt u ur trust much tell plz nxt time dont use word ok chikku
0,noic text,31,8,2,noic text
0,hi di yiju meet 7 pm esaplanad tonight,59,14,1,hi di yiju meet 7 pm esaplanad tonight
1,mobi pub high street prize u know new duchess cornwal txt first name stop 008704050406 sp,156,30,2,mobi pub high street prize u know new duchess cornwal txt first name stop 008704050406 sp
1,week savamob member offer access call 08709501522 detail savamob pobox 139 la3 2wu savamob offer mobil,159,31,5,week savamob member offer access call 08709501522 detail savamob pobox 139 la3 2wu savamob offer mobil
0,aight set free think could text blake address occur quit sure thought,138,35,2,aight set free think could text blake address occur quit sure thought
0,hi dear saw dear happi batteri low,67,17,3,hi dear saw dear happi batteri low
0,age abj,37,11,3,age abj
0,prof pass paper sem congrat student enna kalaachutaarama prof gud mrng,122,33,7,prof pass paper sem congrat student enna kalaachutaarama prof gud mrng
0,dont kick coco,29,7,1,dont kick coco
0,fyi gon na call sporad start like lt gt bc doin shit,97,26,1,fyi gon na call sporad start like lt gt bc doin shit
1,contact date servic someon know find call mobil landlin 09064017305 pobox75ldns7,149,28,2,contact date servic someon know find call mobil landlin 09064017305 pobox75ldns7
1,chase us sinc sept definit pay thank inform ignor kath manchest,141,26,5,chase us sinc sept definit pay thank inform ignor kath manchest
0,hope youåõr much fun without see u tomorrow love jess x,76,17,2,hope youåõr much fun without see u tomorrow love jess x
0,ok wont call disturb one know avoid burden,84,22,3,ok wont call disturb one know avoid burden
0,reach home n bath liao u call,56,15,1,reach home n bath liao u call
1,loan purpos even bad credit tenant welcom call 08717111821,106,18,3,loan purpo even bad credit tenant welcom call 08717111821
0,actual exam harder nbme,36,7,1,actual exam harder nbme
0,lot sick thing go round take easi hope u feel better soon lol,84,20,4,lot sick thing go round take easi hope u feel better soon lol
0,god pick flower dippeditinadew lovingli touch itwhichturnedinto u gift tomeandsaid friend 4u,128,23,1,god pick flower dippeditinadew lovingli touch itwhichturnedinto u gift tomeandsaid friend 4u
1,87077 kick new season 2wk free goal news ur mobil txt ur club name 87077 eg villa 87077,114,27,2,87077 kick new season 2wk free goal news ur mobil txt ur club name 87077 eg villa 87077
0,hey sathya till dint meet even singl time saw situat sathya,96,21,1,hey sathya till dint meet even singl time saw situat sathya
0,gam gone outstand inning,35,6,1,gam gone outstand inning
0,play smash bro lt gt religi,46,14,1,play smash bro lt gt religi
0,sir good morn hope good weekend call let know abl rais lt gt dad howev said would make rest avail mid amount still quit short hope would help good day abiola,276,69,7,sir good morn hope good weekend call let know abl rai lt gt dad howev said would make rest avail mid amount still quit short hope would help good day abiola
0,hurri home soup done,25,7,2,hurri home soup done
0,check room befor activ,46,10,2,check room befor activ
0,good afternoon love good see word ym get tm smart move slave smile drink coffe await,153,39,4,good afternoon love good see word ym get tm smart move slave smile drink coff await
0,quit ok bit ex u better go eat smth els feel guilti,74,19,1,quit ok bit ex u better go eat smth el feel guilti
1,orang bring rington time chart hero free hit week go rington pic wap stop receiv tip repli stop,154,33,3,orang bring rington time chart hero free hit week go rington pic wap stop receiv tip repli stop
0,lem know,27,7,1,lem know
1,privat 2003 account statement 07973788240 show 800 point call 08715203649 identifi code 40533 expir,148,24,3,privat 2003 account statement 07973788240 show 800 point call 08715203649 identifi code 40533 expir
0,need stop go bed make fuck deal,63,13,1,need stop go bed make fuck deal
0,love brother time talk english grin say hey muhommad penni say hello across sea,147,35,4,love brother time talk english grin say hey muhommad penni say hello across sea
1,tri call repli sm video mobil 750 min unlimit text free camcord repli call 08000930705,135,27,1,tri call repli sm video mobil 750 min unlimit text free camcord repli call 08000930705
0,hey doc pl want get nice shirt hubbi nice fite one budget lt gt k help pl load card abi hw keep post luv 2 mj,154,44,2,hey doc pl want get nice shirt hubbi nice fite one budget lt gt k help pl load card abi hw keep post luv 2 mj
0,remain unconvinc elabor test willpow,70,13,1,remain unconvinc elabor test willpow
0,noth wen v get life everyth wen v miss someth real valu peopl wil realiz absenc gud mrng,163,37,3,noth wen v get life everyth wen v miss someth real valu peopl wil realiz absenc gud mrng
0,miss,24,8,2,miss
0,ai answerin phone actual pretti reason hour sleepi,85,18,1,ai answerin phone actual pretti reason hour sleepi
0,hey rite u put åè10 evey mnth,49,14,1,hey rite u put åè10 evey mnth
0,go bed prin,26,7,1,go bed prin
0,think see tomo,48,9,1,think see tomo
0,u dun drive go 2 sch,35,11,1,u dun drive go 2 sch
0,home lei,24,7,1,home lei
1,gsoh good spam ladi u could b male gigolo 2 join uk fastest grow men club repli oncal mjzgroup repli stop msg,167,36,6,gsoh good spam ladi u could b male gigolo 2 join uk fastest grow men club repli oncal mjzgroup repli stop msg
0,ok come ur home half hour,49,12,1,ok come ur home half hour
1,u secret admir look 2 make contact r reveal think ur 09058094599,132,26,1,u secret admir look 2 make contact r reveal think ur 09058094599
0,u hav frnd name ashwini ur colleg,48,12,1,u hav frnd name ashwini ur colleg
0,ju finish lunch way home lor tot u dun wan 2 stay sch today,80,21,2,ju finish lunch way home lor tot u dun wan 2 stay sch today
0,k 2marrow come class,39,9,1,k 2marrow come class
1,hot live fantasi call 08707500020 20p per min ntt ltd po box 1327 croydon cr9 5wb 0870 nation rate call,122,25,1,hot live fantasi call 08707500020 20p per min ntt ltd po box 1327 croydon cr9 5wb 0870 nation rate call
0,pl send address sir,29,7,1,pl send address sir
0,want lick pussi,32,8,1,want lick pussi
0,yo gon na still stock tri get dubsack,75,18,2,yo gon na still stock tri get dubsack
1,urgent mobil number award ukp 2000 prize guarante call 09061790125 landlin claim valid 12hr 150ppm,141,28,5,urgent mobil number award ukp 2000 prize guarant call 09061790125 landlin claim valid 12hr 150ppm
0,see prolli yeah,25,7,1,see prolli yeah
0,thought could go dinner treat seem ok,60,16,3,thought could go dinner treat seem ok
0,stand away heart ach without wonder crave,154,40,6,stand away heart ach without wonder crave
0,sorri never hear unless book one kinda joke thet realli look skinni white girl one line much camera someth like cast look,230,52,5,sorri never hear unless book one kinda joke thet realli look skinni white girl one line much camera someth like cast look
0,,27,8,1,
0,sure thing big man hockey elect 6 go longer hour though,94,20,2,sure thing big man hockey elect 6 go longer hour though
0,watch lor saw swatch one thk quit ard 116 need 2nd opinion leh,87,22,2,watch lor saw swatch one thk quit ard 116 need 2nd opinion leh
0,hiya u like hlday pic look horribl took mo how camp amrca thing speak soon serena,116,27,3,hiya u like hlday pic look horribl took mo camp amrca thing speak soon serena
0,babe goe day miss alreadi love love kiss hope everyth goe well,126,32,5,babe goe day miss alreadi love love kiss hope everyth goe well
0,yunni goin late,28,8,2,yunni goin late
0,doc prescrib morphin caus pain med enough wait mom bring med kick fast gon na tri later,160,37,3,doc prescrib morphin cau pain med enough wait mom bring med kick fast gon na tri later
0,cool want go kappa meet outsid mu,60,15,1,cool want go kappa meet outsid mu
0,hey sexi bun told ador loverboy hope rememb thank sister law meatbal grin love babe,153,37,4,hey sexi bun told ador loverboy hope rememb thank sister law meatbal grin love babe
0,may b approv panalam post,55,12,1,may b approv panalam post
1,spjanuari male sale hot gay chat cheaper call nation rate cheap peak stop text call 08712460324,157,30,4,spjanuari male sale hot gay chat cheaper call nation rate cheap peak stop text call 08712460324
0,sorri call later,22,6,1,sorri call later
0,dont thnk wrong call us,42,9,1,dont thnk wrong call us
0,workin get job,36,11,2,workin get job
0,done mean,34,9,1,done mean
0,ur luck love someon ur fortun love one love,77,19,3,ur luck love someon ur fortun love one love
0,hi babi ive got back work want see u allday hope didnt piss u phone today u give call xxx,147,38,3,hi babi ive got back work want see u allday hope didnt piss u phone today u give call xxx
1,freemsg today day readi horni live town love sex fun game netcollex ltd 08700621170150p per msg repli stop end,152,35,4,freemsg today day readi horni live town love sex fun game netcollex ltd 08700621170150p per msg repli stop end
0,yahoo boy bring perf legal,55,14,2,yahoo boy bring perf legal
0,need say anyth know outsid,54,14,2,need say anyth know outsid
0,ever one foot,34,8,1,ever one foot
0,got lt gt,22,10,1,got lt gt
0,good need done ye pleas tell number could ring,111,26,4,good need done ye plea tell number could ring
0,ever green quot ever told jerri cartoon person irrit u alway one love u vri much fail express gud nyt,160,42,2,ever green quot ever told jerri cartoon person irrit u alway one love u vri much fail express gud nyt
0,leav wif lar ìï wan carri meh heavi da num 98321561 familiar,89,22,1,leav wif lar ìï wan carri meh heavi da num 98321561 familiar
0,beauti truth express face could seen everyon depress heart could understood love one gud ni8,153,32,2,beauti truth express face could seen everyon depress heart could understood love one gud ni8
0,infact happi new year see,67,15,2,infact happi new year see
1,simpson movi releas juli 2007 name band die start film day day day send b c,146,37,3,simpson movi relea juli 2007 name band die start film day day day send b c
0,shame mayb cld meet hr tomo,48,13,2,shame mayb cld meet hr tomo
0,lol would despit cramp like girl,57,13,1,lol would despit cramp like girl
0,canåõt wait cornwal hope tonight isnåõt bad well itåõ rock night shite anyway iåõm go kip good night speak soon,161,36,4,canåõt wait cornwal hope tonight isnåõt bad well itåõ rock night shite anyway iåõm go kip good night speak soon
0,pl help tell sura expect batteri hont pl send messag download movi thank,139,30,3,pl help tell sura expect batteri hont pl send messag download movi thank
1,pleas call amanda regard renew upgrad current handset free charg offer end today tel 0845 021 3680 subject c,160,32,3,plea call amanda regard renew upgrad current handset free charg offer end today tel 0845 021 3680 subject c
0,found way get anoth app phone eh go net cafe take job geeee need babe crave see,158,41,5,found way get anoth app phone eh go net cafe take job geeee need babe crave see
0,work mon thur sat cant leh book liao day u free,90,22,3,work mon thur sat cant leh book liao day u free
0,ìï comin fetch us oredi,29,7,1,ìï comin fetch us oredi
0,nanni address,22,5,1,nanni address
1,urgent 4 costa del sol holiday await collect call 09050090044 toclaim sae tc pobox334 stockport sk38xh max10min,161,34,4,urgent 4 costa del sol holiday await collect call 09050090044 toclaim sae tc pobox334 stockport sk38xh max10min
0,haf u eaten wat time u wan 2 come,38,12,2,haf u eaten wat time u wan 2 come
1,want new video phone 750 anytim network min half price line rental free text 3 month repli call 08000930705 free deliveri,144,29,4,want new video phone 750 anytim network min half price line rental free text 3 month repli call 08000930705 free deliveri
0,yo call get chanc friend mine want ask big order,92,23,1,yo call get chanc friend mine want ask big order
0,singl singl answer fight plu said broke didnt repli,84,17,2,singl singl answer fight plu said broke didnt repli
0,certainli put thing perspect someth like happen,74,11,1,certainli put thing perspect someth like happen
0,got tv 2 watch meh u work today,40,12,2,got tv 2 watch meh u work today
0,felt convey reason ese,63,16,1,felt convey reason ese
1,mobil 11 month u r entitl updat latest colour mobil camera free call mobil updat co free 08002986030,154,31,3,mobil 11 month u r entitl updat latest colour mobil camera free call mobil updat co free 08002986030
0,go got excit karaok type activ plan debat whether play footbal eve feel lazi though,134,27,4,go got excit karaok type activ plan debat whether play footbal eve feel lazi though
0,told come wednesday,35,8,1,told come wednesday
0,ok call mom instead fun,35,8,1,ok call mom instead fun
1,dear voucher holder claim week offer pc pleas go http ts cs appli,112,25,2,dear voucher holder claim week offer pc plea go http ts cs appli
0,well desper call armand,54,12,1,well desper call armand
0,work right,27,7,1,work right
1,congrat nokia 3650 video camera phone call 09066382422 call cost 150ppm ave call 3min vari mobil close 300603 post bcm4284 ldn wc1n3xx,157,27,2,congrat nokia 3650 video camera phone call 09066382422 call cost 150ppm ave call 3min vari mobil close 300603 post bcm4284 ldn wc1n3xx
0,heard anyth answer text guess flake said jb fantast,111,24,2,heard anyth answer text guess flake said jb fantast
0,mmmmmm love much ahmad ca wait year begin everi second take closer side happi new year love,157,40,5,mmmmmm love much ahmad ca wait year begin everi second take closer side happi new year love
0,pl full name joke school co fee univers florida seem actual lt gt pl holla back,124,31,1,pl full name joke school co fee univ florida seem actual lt gt pl holla back
0,sorri call later,22,6,1,sorri call later
0,ok said got wisdom teeth hidden insid n mayb need 2 remov,77,18,2,ok said got wisdom teeth hidden insid n mayb need 2 remov
0,pl pl drink plenti plenti water,37,7,1,pl pl drink plenti plenti water
0,queen go royal wed,71,17,3,queen go royal wed
0,lag sad part keep touch thank skype,74,19,2,lag sad part keep touch thank skype
0,ok lor go tog lor,28,8,1,ok lor go tog lor
0,two team wait player,34,6,1,two team wait player
0,send copi da report,35,10,1,send copi da report
0,swhrt u dey hope ur ok tot u n care,67,17,1,swhrt u dey hope ur ok tot u n care
0,ok da alreadi plan wil pick,41,12,2,ok da alreadi plan wil pick
1,urgent pleas call abta complimentari 4 spanish holiday cash await collect sae cs box 47 po19 2ez 150ppm,144,28,3,urgent plea call abta complimentari 4 spanish holiday cash await collect sae cs box 47 po19 2ez 150ppm
0,sorri call later meet,33,8,1,sorri call later meet
0,realli need shit tomorrow know wo awak like 6,83,18,1,realli need shit tomorrow know wo awak like 6
0,good regist vote,38,10,2,good regist vote
0,hmm ok stay like hour co eye realli sore,61,17,1,hmm ok stay like hour co eye realli sore
0,dear got bu directli calicut,32,6,1,dear got bu directli calicut
0,mm umma ask vava also come tell play later togeth,62,13,1,mm umma ask vava also come tell play later togeth
0,well gener price lt gt let know much want,79,21,1,well gener price lt gt let know much want
0,sorri call later,22,6,1,sorri call later
0,moment day bring hope afternoon bring faith even bring luv night bring rest wish u find morn,158,32,1,moment day bring hope afternoon bring faith even bring luv night bring rest wish u find morn
0,lt gt w jetton ave forgot,37,13,1,lt gt w jetton ave forgot
0,ok come home,23,7,1,ok come home
0,use foreign stamp countri,43,9,1,use foreign stamp countri
1,doubl min txt 4 6month free bluetooth orang avail soni nokia motorola phone call mobileupd8 08000839402,149,25,3,doubl min txt 4 6month free bluetooth orang avail soni nokia motorola phone call mobileupd8 08000839402
0,sorri lot stuff talk actual guy want buy,108,25,1,sorri lot stuff talk actual guy want buy
1,free 1st week no1 nokia tone 4 ur mob everi week txt nokia 8007 get txting tell ur mate pobox 36504 w45wq,158,30,2,free 1st week no1 nokia tone 4 ur mob everi week txt nokia 8007 get txting tell ur mate pobox 36504 w45wq
1,want funk ur fone weekli new tone repli tones2u 2 text origin n best tone 3gbp network oper rate appli,155,30,3,want funk ur fone weekli new tone repli tones2u 2 text origin n best tone 3gbp network oper rate appli
1,cmon babe make horni turn txt fantasi babe im hot sticki need repli cost 2 cancel send stop,148,39,4,cmon babe make horni turn txt fantasi babe im hot sticki need repli cost 2 cancel send stop
0,come tomorrow di,23,5,1,come tomorrow di
0,wyli updat weed dealer carlo went freedom class lunsford,81,16,1,wyli updat weed dealer carlo went freedom class lunsford
0,happi babi alright take job hope fine send kiss make smile across sea kiss kiss,154,40,5,happi babi alright take job hope fine send kiss make smile across sea kiss kiss
0,c movi juz last minut decis mah juz watch 2 lar tot interest,85,20,2,c movi juz last minut deci mah juz watch 2 lar tot interest
0,enjoy semest take care brother,54,11,2,enjoy semest take care brother
1,import inform 4 orang user 0796xxxxxx today ur lucki day 2 find log onto http fantast prizeawait,157,29,2,import inform 4 orang user 0796xxxxxx today ur lucki day 2 find log onto http fantast prizeawait
0,get door,22,7,1,get door
0,let use next week princess,34,9,1,let use next week princess
0,go home first lar wait 4 lor put stuff first,69,19,2,go home first lar wait 4 lor put stuff first
0,want kfc tuesday buy 2 meal gravi 2 mark 2,74,22,5,want kfc tuesday buy 2 meal gravi 2 mark 2
0,da stupid da alway send like believ mental,102,26,1,da stupid da alway send like believ mental
0,oi gon na ring,22,6,1,oi gon na ring
1,miss call alert number call left messag 07008009200,72,13,3,miss call alert number call left messag 07008009200
0,attend noth,32,7,1,attend noth
0,ard 530 like dat lor juz meet mrt station dun haf come,77,20,2,ard 530 like dat lor juz meet mrt station dun haf come
0,dear sleep,26,7,1,dear sleep
0,er mw im fill tuth aight,29,7,1,er mw im fill tuth aight
0,offic around 4 pm go hospit,52,13,2,offic around 4 pm go hospit
0,actual wait 2 week start put ad,60,13,1,actual wait 2 week start put ad
0,anyth lor go go lor,44,11,1,anyth lor go go lor
0,u free sat rite u wan 2 watch infern affair wif n darren n mayb xy,77,20,2,u free sat rite u wan 2 watch infern affair wif n darren n mayb xy
0,plz note anyon call mobil amp ask u type lt gt lt gt disconnect call coz iz attempt make use sim card itz confirmd nokia n motorola n verifi cnn ibn,263,75,4,plz note anyon call mobil amp ask u type lt gt lt gt disconnect call coz iz attempt make use sim card itz confirmd nokia n motorola n verifi cnn ibn
