target,text,num_characters,num_words,num_sentences,transformed_text
0,wat make u thk fall actual thk quit prone 2 fall lucki dad home ask come n fetch alreadi,131,34,3,wat make u thk fall actual thk quit prone 2 fall lucki dad home ask come n fetch alreadi
1,07801543489 guarante latest nokia phone 40gb ipod mp3 player prize txt word collect,159,30,3,07801543489 guarant latest nokia phone 40gb ipod mp3 player prize txt word collect
0,account refil success inr lt decim gt keralacircl prepaid account balanc rs lt decim gt transact id kr lt gt,174,44,3,account refil success inr lt decim gt keralacircl prepaid account balanc rs lt decim gt transact id kr lt gt
0,wont touch permiss,42,9,1,wont touch permiss
1,hi luci hubbi meetin day fri b alon hotel u fanci cumin pl leav msg 2day 09099726395 luci x,161,29,2,hi luci hubbi meetin day fri b alon hotel u fanci cumin pl leav msg 2day 09099726395 luci x
0,7 wonder world 7th 6th ur style 5th ur smile 4th ur person 3rd ur natur 2nd ur sm 1st love good morn dear,153,33,1,7 wonder world 7th 6th ur style 5th ur smile 4th ur person 3rd ur natur 2nd ur sm 1st love good morn dear
0,take small dose tablet fever,37,7,1,take small dose tablet fever
0,oh u must taken real valentin shop first,61,13,2,oh u must taken real valentin shop first
0,sent email address incomm right,74,18,1,sent email address incomm right
0,gon na blake night might abl get littl earli,93,25,2,gon na blake night might abl get littl earli
0,friendship game play word say start march end may tomorrow yesterday today e,141,35,1,friendship game play word say start march end may tomorrow yesterday today e
0,nice wait text right gon na pay ticket ya know,85,23,3,nice wait text right gon na pay ticket ya know
0,watch lotr w si di aft u wan 2 meet 4 dinner nite,78,23,2,watch lotr w si di aft u wan 2 meet 4 dinner nite
0,keep away like,33,7,1,keep away like
0,think far find check googl map place dorm,90,21,2,think far find check googl map place dorm
0,trip ok quit tire lor uni start today ok 4 co take modul ju concentr final yr project,147,34,2,trip ok quit tire lor uni start today ok 4 co take modul ju concentr final yr project
0,alway say welp,33,7,1,alway say welp
0,guy browsin compulsori,32,8,1,guy browsin compulsori
0,ok,5,2,1,ok
0,puriti friendship two smile read forward messag smile see name gud evng musthu,149,27,2,puriti friendship two smile read forward messag smile see name gud evng musthu
0,sorri call later,22,6,1,sorri call later
0,add realli care ca least get dude fuck hey money want,132,35,1,add realli care ca least get dude fuck hey money want
0,hello lover goe new job happi think wake slave send teas kiss across sea,154,39,6,hello lover goe new job happi think wake slave send tea kiss across sea
0,told number gautham,31,7,1,told number gautham
0,tell need investig anywher,51,10,1,tell need investig anywh
0,ok juz receiv,18,5,1,ok juz receiv
0,cant believ said mani thing morn realli want say good morn love beauti morn see librari later,172,38,3,cant believ said mani thing morn realli want say good morn love beauti morn see librari later
1,account credit 500 free text messag activ txt word credit 80488 cs,130,28,2,account credit 500 free text messag activ txt word credit 80488 cs
0,end might still vomit okay everyth come,76,17,2,end might still vomit okay everyth come
0,money money aint thing sha,78,21,1,money money aint thing sha
0,everyth weather keep extra warm cold noth seriou pl lot vitamin c,112,25,4,everyth weather keep extra warm cold noth seriou pl lot vitamin c
0,hey gal anyon u go e drive centr tmr,58,14,2,hey gal anyon u go e drive centr tmr
0,alway yahoo messeng send messag get may send mobil mode sha get repli,158,38,3,alway yahoo messeng send messag get may send mobil mode sha get repli
0,put readi lt time gt,60,19,2,put readi lt time gt
0,time n smile r two crucial thing life sometim time make us forget smile sometim someon smile make us forget time gud noon,154,32,2,time n smile r two crucial thing life sometim time make us forget smile sometim someon smile make us forget time gud noon
1,sm ac jsco energi high u may know 2channel 2day ur leadership skill r strong psychic repli an end repli end jsco,154,36,7,sm ac jsco energi high u may know 2channel 2day ur leadership skill r strong psychic repli end repli end jsco
0,idp linux system,34,6,1,idp linux system
1,hot live fantasi call 08707509020 20p per min ntt ltd po box 1327 croydon cr9 5wb 0870 nation rate call,122,25,1,hot live fantasi call 08707509020 20p per min ntt ltd po box 1327 croydon cr9 5wb 0870 nation rate call
0,da what plan,26,9,1,da plan
0,ill lt gt ok,31,13,1,ill lt gt ok
0,oh god almost home,26,8,2,oh god almost home
0,total video convert free download type googl search,64,12,1,total video convert free download type googl search
1,thank vote sing along star karaok mobil free link repli sing,121,27,3,thank vote sing along star karaok mobil free link repli sing
0,wen ur lovabl bcum angri wid u dnt take serious coz angri childish n true way show deep affect care n luv kettoda manda nice day da,179,41,2,wen ur lovabl bcum angri wid u dnt take seriou coz angri childish n true way show deep affect care n luv kettoda manda nice day da
0,sound like someth someon test would sayi,56,9,1,sound like someth someon test would sayi
0,u love someon dont make love u much u love much dont want love anyon except gud nit,148,36,2,u love someon dont make love u much u love much dont want love anyon except gud nit
0,pete phone still jenni colleg,90,22,3,pete phone still jenni colleg
0,oop sorri check mind pick tomo half eight station would ok,110,26,3,oop sorri check mind pick tomo half eight station would ok
0,hey sweet wonder moment might come want send file someon wo go yahoo connect suck rememb set page go download format disc could tell know way download big file download stuff directli internet help would great prey teas kiss,458,102,6,hey sweet wonder moment might come want send file someon wo go yahoo connect suck rememb set page go download format disc could tell know way download big file download stuff directli internet help would great prey tea kiss
0,how champ leav glasgow,36,7,1,champ leav glasgow
0,k best congrat,28,10,1,k best congrat
0,wonder get text,33,9,1,wonder get text
0,need come home give good lovin,51,12,1,need come home give good lovin
1,brand new mobil music servic live free music player arriv shortli instal phone brows content top artist,157,31,3,brand new mobil music servic live free music player arriv shortli instal phone brow content top artist
0,shall ask one thing dont mistak,45,11,1,shall ask one thing dont mistak
0,check wid corect spele sarcasm,37,7,2,check wid corect spele sarcasm
1,urgent mobil award bonu caller prize 2nd attempt contact call box95qu bt nation rate,159,30,4,urgent mobil award bonu caller prize 2nd attempt contact call box95qu bt nation rate
0,angri happen dear,39,9,2,angri happen dear
0,thk u dun haf 2 hint e forum alreadi lor co told ron n darren go 2 tell shuhui,96,25,1,thk u dun haf 2 hint e forum alreadi lor co told ron n darren go 2 tell shuhui
0,yup ok thanx,15,4,1,yup ok thanx
0,hi ct employe,29,9,1,hi ct employ
0,pl pl find aunt nike,32,8,1,pl pl find aunt nike
0,wow love sooo much know bare stand wonder day goe well love think miss,152,39,5,wow love sooo much know bare stand wonder day goe well love think miss
0,scream mean shout,29,5,1,scream mean shout
0,hey happen de alright,36,9,2,hey happen de alright
0,pick receipt someth earlier,54,10,1,pick receipt someth earlier
0,think chennai well settl,29,6,1,think chennai well settl
0,oh dang mean send lol,47,15,3,oh dang mean send lol
0,unfortun found pick sister airport even think go tri go one th,172,40,2,unfortun found pick sister airport even think go tri go one th
0,horribl bf v hungri,32,8,2,horribl bf v hungri
0,rememb day,22,5,1,rememb day
1,nokia 7250i get win free auction take part send nokia 86021,150,31,4,nokia 7250i get win free auction take part send nokia 86021
0,feel real valentin yo valentin even tho u hardli play,91,23,4,feel real valentin yo valentin even tho u hardli play
0,sound good finger make difficult type,53,11,3,sound good finger make difficult type
0,midnight earliest,24,4,1,midnight earliest
0,sure tri make xavier smoke want smoke told smoke much,121,28,1,sure tri make xavier smoke want smoke told smoke much
0,k come nordstrom done,36,8,1,k come nordstrom done
0,u konw waht rael friendship im gving yuo exmpel jsut ese tih msg evrey splle tih msg wrnog bt sitll yuo ra wihtuot ayn mitsak goodnight amp nice sleep sweet dream,212,48,1,u konw waht rael friendship im gving yuo exmpel jsut ese tih msg evrey splle tih msg wrnog bt sitll yuo ra wihtuot ayn mitsak goodnight amp nice sleep sweet dream
0,press confer da,25,6,1,press confer da
1,hello orang 1 month free access game news sport plu 10 free text 20 photo messag repli ye term appli,156,33,3,hello orang 1 month free access game news sport plu 10 free text 20 photo messag repli ye term appli
0,complet degre use join financ,59,12,2,complet degr use join financ
0,good afternoon love job prospect miss lazi bleak hmmm happi fill love,155,37,6,good afternoon love job prospect miss lazi bleak hmmm happi fill love
0,shant disturb u anymor jia,37,8,1,shant disturb u anymor jia
0,bishan lar nearer need buy earli co buy got ta park car,79,20,1,bishan lar nearer need buy earli co buy got ta park car
0,dont know oh,24,7,1,dont know oh
0,dude sux snake got old raiden got buff,50,12,2,dude sux snake got old raiden got buff
0,say hi get ass back south tampa prefer kegger,75,18,1,say hi get ass back south tampa prefer kegger
0,e msg ju u said thank gift,41,12,2,e msg ju u said thank gift
0,u,8,3,1,u
0,ok dear call chechi,36,9,2,ok dear call chechi
0,yeah tote u wan na,31,10,2,yeah tote u wan na
0,ok found di pierr cardin one look normal cost 20 sale,73,16,1,ok found di pierr cardin one look normal cost 20 sale
0,good sleep rhythm person establish rhythm bodi learn use want know,127,30,3,good sleep rhythm person establish rhythm bodi learn use want know
0,wat r u,14,5,1,wat r u
0,messag truro hospit ext phone phone side,97,25,4,messag truro hospit ext phone phone side
0,singl line big mean anyth 4 ur best,73,21,1,singl line big mean anyth 4 ur best
0,got ga money chanc gang want go grand natur adventur,92,21,1,got ga money chanc gang want go grand natur adventur
0,dnt worri use ice piec cloth take 2 tablet,63,14,1,dnt worri use ice piec cloth take 2 tablet
0,dude saw park car sunroof pop sux,58,13,2,dude saw park car sunroof pop sux
0,get readi put excel sub face,46,11,1,get readi put excel sub face
0,tmrw im finish 9 door,26,6,2,tmrw im finish 9 door
0,lt gt g saw day ago guy want sell wifi lt gt 3g lt gt blank,143,50,2,lt gt g saw day ago guy want sell wifi lt gt 3g lt gt blank
0,late,29,9,2,late
0,whatev im pretti piss,31,7,1,whatev im pretti piss
0,today accept day u accept brother sister lover dear1 best1 clos1 lvblefrnd jstfrnd cutefrnd lifpartnr belovd swtheart bstfrnd rpli mean enemi,156,27,2,today accept day u accept brother sister lover dear1 best1 clos1 lvblefrnd jstfrnd cutefrnd lifpartnr belovd swtheart bstfrnd rpli mean enemi
0,dont much imag class,37,9,1,dont much imag class
0,got rumour go buy apart chennai,63,18,1,got rumour go buy apart chennai
0,near kalainar tv,33,4,1,near kalainar tv
1,ur current 500 pound maxim ur send go 86688 cc 08718720201,145,23,2,ur current 500 pound maxim ur send go 86688 cc 08718720201
1,sm auction brand new nokia 7250 4 auction today auction free 2 join take part txt nokia 86021,149,31,4,sm auction brand new nokia 7250 4 auction today auction free 2 join take part txt nokia 86021
0,si catch e show e afternoon watch w c u wan 2 watch today tmr lor,104,28,2,si catch e show e afternoon watch w c u wan 2 watch today tmr lor
0,sound gd haha wah u yan jiu fast liao,58,16,1,sound gd haha wah u yan jiu fast liao
0,nosi guess idk react freak,62,18,3,nosi guess idk react freak
0,rememb hurt day satan impost pay price destini keep go u said pray get mind get,184,41,1,rememb hurt day satan impost pay price destini keep go u said pray get mind get
0,make girl happi difficult make girl happi u need friend companion lover chef lt gt good listen lt gt organ lt gt good boyfriend lt gt clean lt gt sympathet lt gt athlet lt gt warm lt gt courag lt gt determin lt gt true lt gt depend lt gt intellig lt gt psychologist lt gt pest extermin lt gt psychiatrist lt gt healer lt gt stylist lt gt driver aaniy pudunga venaam,611,220,38,make girl happi difficult make girl happi u need friend companion lover chef lt gt good listen lt gt organ lt gt good boyfriend lt gt clean lt gt sympathet lt gt athlet lt gt warm lt gt courag lt gt determin lt gt true lt gt depend lt gt intellig lt gt psychologist lt gt pest extermin lt gt psychiatrist lt gt healer lt gt stylist lt gt driver aaniy pudunga venaam
0,princess bet brotha chase,61,15,2,princess bet brotha chase
0,shall book chez jule half eight ok,62,16,1,shall book chez jule half eight ok
0,hhahhaahahah rofl wtf nig leonardo room someth,64,11,1,hhahhaahahah rofl wtf nig leonardo room someth
0,yep derek hous see sunday lt 3,47,15,1,yep derek hou see sunday lt 3
0,cool let know kick around lt gt day,92,28,1,cool let know kick around lt gt day
0,sorri call later,22,6,1,sorri call later
0,wonder would okay call uncl john let know thing nigeria r lt gt dollar 2year sent know strain plan pay back everi dime give everi dime expect anyth practic someth like,338,79,4,wonder would okay call uncl john let know thing nigeria r lt gt dollar 2year sent know strain plan pay back everi dime give everi dime expect anyth practic someth like
0,charg transfer charg withdraw anyhow like,86,15,1,charg transfer charg withdraw anyhow like
0,dont search love let love find that call fall love bcoz u dont forc u fall u know smeon hold u bslvyl,159,36,1,dont search love let love find call fall love bcoz u dont forc u fall u know smeon hold u bslvyl
0,let go bill miller,30,9,2,let go bill miller
0,love set soul fire spark flame big rawr flame xoxo,105,30,6,love set soul fire spark flame big rawr flame xoxo
0,somewhr someon sure made 4 god decid perfect time make u meet dat person till den enjoy ur crush,148,43,12,somewhr someon sure made 4 god decid perfect time make u meet dat person till den enjoy ur crush
0,honeymoon outfit,30,8,2,honeymoon outfit
0,help propos go back tomorrow,52,10,1,help propo go back tomorrow
1,privat 2003 account statement show 800 point call 08719899230 identifi code 41685 expir,136,23,3,privat 2003 account statement show 800 point call 08719899230 identifi code 41685 expir
0,never blame day ur life good day give u happi bad day give u experi essenti life god bless good morn,152,35,7,never blame day ur life good day give u happi bad day give u experi essenti life god bless good morn
0,pl confirm time collect chequ,43,9,1,pl confirm time collect chequ
1,regist subscrib yr draw 4 gift voucher b enter receipt correct an next olymp txt an 80062,146,31,3,regist subscrib yr draw 4 gift voucher b enter receipt correct next olymp txt 80062
1,urgent mobil number award prize guarante call 09061790121 land line claim valid 12hr 150ppm,144,27,5,urgent mobil number award prize guarant call 09061790121 land line claim valid 12hr 150ppm
0,daddi take good care,35,9,1,daddi take good care
0,yeah probabl still got ta check leo,47,11,1,yeah probabl still got ta check leo
0,special,25,5,1,special
0,carlo take sweet time usual let know patti smoke tell haul ass,127,28,1,carlo take sweet time usual let know patti smoke tell haul ass
0,ok noth problem,25,8,2,ok noth problem
0,heard job go wildlif talk tonight u want2com that2worzel wizzl whatev,143,31,4,heard job go wildlif talk tonight u want2com that2worzel wizzl whatev
0,god pick flower dippeditinadew lovingli touch itwhichturnedinto u gift tomeandsaid friend 4u,128,23,1,god pick flower dippeditinadew lovingli touch itwhichturnedinto u gift tomeandsaid friend 4u
0,came hostel,24,6,1,came hostel
0,ok prob come lunch,43,11,2,ok prob come lunch
0,ju tell u dat b leav 4 shanghai 21st instead haf time 2 meet cya,99,24,1,ju tell u dat b leav 4 shanghai 21st instead haf time 2 meet cya
0,freez home yet rememb kiss mom morn love think miss yet,152,37,6,freez home yet rememb kiss mom morn love think miss yet
0,readi big day tomorrow,37,9,1,readi big day tomorrow
0,probabl around mu lot,32,8,1,probabl around mu lot
0,645,3,1,1,645
1,pro video club need help info call 08701237397 must club credit redeem enjoy,153,27,3,pro video club need help info call 08701237397 must club credit redeem enjoy
0,thnx dude u guy 2nite,28,8,2,thnx dude u guy 2nite
0,sef dey laugh meanwhil darl anji,55,13,2,sef dey laugh meanwhil darl anji
0,mm food da,28,8,1,mm food da
0,k make sens btw carlo difficult guy gon na smoke go pick second batch get ga,121,28,1,k make sen btw carlo difficult guy gon na smoke go pick second batch get ga
0,u download fring app,29,7,1,u download fring app
0,2 oz guy kinda flaki one friend interest pick lt gt worth tonight possibl,115,28,1,2 oz guy kinda flaki one friend interest pick lt gt worth tonight possibl
0,friend u stay fb chat,39,9,1,friend u stay fb chat
0,fuck babe miss sooooo much wish sleep bed lone go sleep dream love,154,41,4,fuck babe miss sooooo much wish sleep bed lone go sleep dream love
0,live simpl love also simpl laugh simpl win tooo simpl difficult gud nte,148,34,4,live simpl love also simpl laugh simpl win tooo simpl difficult gud nte
1,u secret admir look 2 make contact r reveal think ur 09058094599,132,26,1,u secret admir look 2 make contact r reveal think ur 09058094599
0,ah well confus thing,44,10,1,ah well confu thing
1,500 free text msg text ok 80488 credit account,71,16,2,500 free text msg text ok 80488 credit account
0,hi dear call urgnt know what problem want work problem least tell wate repli,156,38,4,hi dear call urgnt know problem want work problem least tell wate repli
0,dear ok,25,8,2,dear ok
1,select stay 1 250 top british hotel noth holiday worth claim call london bx 526 sw73ss,147,32,4,select stay 1 250 top british hotel noth holiday worth claim call london bx 526 sw73ss
0,ye princess want make happi,41,10,2,ye princess want make happi
0,sound like mani talent would like go dinner date next week,83,19,2,sound like mani talent would like go dinner date next week
0,go film 2day da 6pm sorri da,45,14,3,go film 2day da 6pm sorri da
0,watch movi alreadi xy want 2 shop shop w,73,18,2,watch movi alreadi xy want 2 shop shop w
0,hello littl parti anim thought buzz friend grin remind love send naughti ador kiss,158,34,2,hello littl parti anim thought buzz friend grin remind love send naughti ador kiss
0,yesterday go home,47,11,2,yesterday go home
1,eeri nokia tone 4u rpli tone titl 8007 eg tone dracula 8007 titl ghost addamsfa munster exorcist twilight pobox36504w45wq 150p,161,29,1,eeri nokia tone 4u rpli tone titl 8007 eg tone dracula 8007 titl ghost addamsfa munster exorcist twilight pobox36504w45wq 150p
0,come life brought sun shini warm heart put constant smile face make feel love care,159,35,2,come life brought sun shini warm heart put constant smile face make feel love care
0,shit surpris went spent even french guy met town fool around bit let fuck,165,40,1,shit surpri went spent even french guy met town fool around bit let fuck
1,0a network allow compani bill sm respons,91,18,1,0a network allow compani bill sm respon
0,great comedi cant stop laugh da,37,9,1,great comedi cant stop laugh da
1,freemsg feelin kinda lnli hope u like 2 keep compani jst got cam mobi wan na c pic txt repli date 82242 msg150p 2rcv hlp 08712317606 stop 82242,160,37,2,freemsg feelin kinda lnli hope u like 2 keep compani jst got cam mobi wan na c pic txt repli date 82242 msg150p 2rcv hlp 08712317606 stop 82242
0,alright set text man,41,11,1,alright set text man
0,hi keen go kind feel go tomo mind,136,39,2,hi keen go kind feel go tomo mind
0,sleep nt feel well,24,4,1,sleep nt feel well
0,u switch fone dammit,35,9,2,u switch fone dammit
0,india take lead,25,7,1,india take lead
0,post l8r class,31,8,2,post l8r class
0,tht wat wright brother fli,36,8,1,tht wat wright brother fli
0,even v good somewhat event laden fill worri head ok throat wreck see six,132,33,3,even v good somewhat event laden fill worri head ok throat wreck see six
0,u laugh realli loud u talk spontan u dont care other feel u probabl dear amp best friend goodeven dear,156,36,3,u laugh realli loud u talk spontan u dont care feel u probabl dear amp best friend goodeven dear
0,laptop take,30,8,1,laptop take
0,dont file bag work call tell find anyth room,118,30,1,dont file bag work call tell find anyth room
0,wan earli lei outsid wun b home earli neva mind,82,20,1,wan earli lei outsid wun b home earli neva mind
1,ur chanc win cash everi wk txt action c custcar 08712405022,123,26,2,ur chanc win cash everi wk txt action c custcar 08712405022
0,bugi juz wat walk home oredi ìï late repli oso saw top dat like din buy r,147,39,3,bugi juz wat walk home oredi ìï late repli oso saw top dat like din buy r
0,wish famili merri ma happi new year advanc,75,17,1,wish famili merri happi new year advanc
0,7 go ok na,22,8,1,7 go ok na
0,ye post coupl pic fb still snow outsid wake,90,24,3,ye post coupl pic fb still snow outsid wake
0,one good partnership go take lead,61,17,1,one good partnership go take lead
1,rgent 2nd attempt contact u u call 09071512433 b4 050703 csbcm4235wc1n3xx callcost 150ppm mobilesvari 50,148,30,5,rgent 2nd attempt contact u u call 09071512433 b4 050703 csbcm4235wc1n3xx callcost 150ppm mobilesvari 50
0,yeah class,28,8,1,yeah class
0,send bec templ na,42,12,2,send bec templ na
0,come home class right need work shower,75,18,2,come home class right need work shower
1,hi ur lookin 4 sauci daytim fun wiv busti marri woman free next week chat 2 sort time 09099726429 janinexx,160,25,1,hi ur lookin 4 sauci daytim fun wiv busti marri woman free next week chat 2 sort time 09099726429 janinexx
0,mostli like,27,7,1,mostli like
0,ìï v fan,14,5,1,ìï v fan
0,dunno co v late n reach insid alreadi ate spageddi lor e gal r laugh lor,129,31,3,dunno co v late n reach insid alreadi ate spageddi lor e gal r laugh lor
0,guess spent last night phase fourth dimens,73,14,1,guess spent last night phase fourth dimen
0,dad gon na call get work ask crazi question,88,21,1,dad gon na call get work ask crazi question
0,ye said,27,8,1,ye said
0,hurt n meaning line ever compromis everyth love,75,13,1,hurt n mean line ever compromi everyth love
0,lmao nice 1,11,4,1,lmao nice 1
0,glad see repli,23,6,1,glad see repli
1,urgent tri contact today draw show prize guarante call 09050001295 land line claim a21 valid 12hr,158,32,5,urgent tri contact today draw show prize guarant call 09050001295 land line claim a21 valid 12hr
1,monthli password wap use wap phone pc,73,16,3,monthli password wap use wap phone pc
0,nah dub je still buff,25,6,1,nah dub je still buff
0,pain thought happi toughest thing earth,81,15,2,pain thought happi toughest thing earth
0,yeah fine get ok,51,17,2,yeah fine get ok
0,lol u come idea,40,10,1,lol u come idea
0,mani peopl seem special first sight remain special till last sight maintain till life end sh ja,156,34,2,mani peopl seem special first sight remain special till last sight maintain till life end sh ja
0,today dedic day song u dedic send ur valuabl frnd first rpli,124,29,2,today dedic day song u dedic send ur valuabl frnd first rpli
0,okay wait ah,18,5,1,okay wait ah
0,lei,6,3,1,lei
0,hi babe u r like bed im sorri tonight realli wan na see u tomorrow call love xxx,126,33,3,hi babe u r like bed im sorri tonight realli wan na see u tomorrow call love xxx
0,alreadi squat new way walk,46,9,1,alreadi squat new way walk
0,want bold 2 bb torch,30,8,1,want bold 2 bb torch
0,cramp stop go back sleep,35,7,2,cramp stop go back sleep
1,today vodafon number end 0089 last four digit select receiv award number match pleas call 09063442151 claim award,174,32,2,today vodafon number end 0089 last four digit select receiv award number match plea call 09063442151 claim award
1,free top rington weekli 1st week subpoli 3 per,114,18,1,free top rington weekli 1st week subpoli 3 per
0,nan sonathaya soladha boss,32,7,2,nan sonathaya soladha boss
0,bring tat cd forget,23,5,1,bring tat cd forget
1,sunshin quiz wkli q win top soni dvd player u know countri algarv txt ansr sp tyron,126,29,3,sunshin quiz wkli q win top soni dvd player u know countri algarv txt ansr sp tyron
0,know rape dude poker,42,11,1,know rape dude poker
0,weightloss girl friend make load money ebay someth give thank god,99,22,4,weightloss girl friend make load money ebay someth give thank god
0,gr8 see messag r u leav congrat dear school wat r ur plan,96,24,4,gr8 see messag r u leav congrat dear school wat r ur plan
0,ìï eatin later eatin wif fren lei ìï go home first,74,18,1,ìï eatin later eatin wif fren lei ìï go home first
0,finish alreadi yar keep say mushi embarrass ok,72,15,2,finish alreadi yar keep say mushi embarrass ok
0,sorri man stash ran dri last night ca pick sunday,76,18,1,sorri man stash ran dri last night ca pick sunday
0,hai priya right doctor said,60,14,2,hai priya right doctor said
1,free msg sorri servic order 81303 could deliv suffici credit pleas top receiv servic,148,31,3,free msg sorri servic order 81303 could deliv suffici credit plea top receiv servic
0,ok,5,2,1,ok
0,pleas ask mummi call father,31,6,1,plea ask mummi call father
0,come room come hous co hous still messi haha,77,18,1,come room come hou co hou still messi haha
0,lost 10 kilo today,33,9,1,lost 10 kilo today
0,tast fish curri,25,6,1,tast fish curri
0,might accid tookplac somewher ghodbandar rd traffic move slove plz slip amp worri,126,27,4,might accid tookplac somewh ghodbandar rd traffic move slove plz slip amp worri
0,yun wkg btw go nu sc ìï wana specialis wad,71,19,2,yun wkg btw go nu sc ìï wana speciali wad
